{
	"$schema": "https://json-schema.org/draft/2020-12/schema",
	"$id": "https://3dagent.vercel.app/.well-known/3d-agent-card.schema.json",
	"title": "3D Agent Card v1",
	"description": "Strict superset of the ERC-8004 registration card (https://eips.ethereum.org/EIPS/eip-8004#registration-v1) for agents whose primary embodiment is a 3D model. Pointed to by the ERC-721 tokenURI on the Identity Registry.",
	"type": "object",
	"required": ["type", "name", "description", "model"],
	"properties": {
		"type": {
			"description": "Conformance URI. MUST include the ERC-8004 registration-v1 URI; SHOULD include the 3D Agent Card v1 URI.",
			"oneOf": [
				{ "type": "string" },
				{ "type": "array", "items": { "type": "string" }, "minItems": 1 }
			]
		},
		"name": { "type": "string", "minLength": 1, "maxLength": 128 },
		"description": { "type": "string", "minLength": 1, "maxLength": 2048 },
		"image": {
			"type": "string",
			"description": "Poster / preview image. SHOULD be ipfs:// for immutability."
		},
		"active": { "type": "boolean" },

		"services": {
			"type": "array",
			"description": "ERC-8004 service endpoints (web, A2A, MCP, etc).",
			"items": {
				"type": "object",
				"required": ["name", "endpoint"],
				"properties": {
					"name": { "type": "string" },
					"endpoint": { "type": "string", "format": "uri" },
					"version": { "type": "string" }
				}
			}
		},

		"x402Support": { "type": "boolean" },

		"registrations": {
			"type": "array",
			"description": "ERC-8004 on-chain registrations as CAIP-10 references.",
			"items": {
				"type": "object",
				"required": ["agentId", "agentRegistry"],
				"properties": {
					"agentId": { "type": ["integer", "string"] },
					"agentRegistry": {
						"type": "string",
						"pattern": "^eip155:[0-9]+:0x[a-fA-F0-9]{40}$"
					}
				}
			}
		},

		"supportedTrust": {
			"type": "array",
			"items": { "type": "string", "enum": ["reputation", "validation", "tee"] }
		},

		"model": {
			"type": "object",
			"description": "3D embodiment. Required for 3D Agent Card v1.",
			"required": ["uri", "format", "sha256"],
			"properties": {
				"uri": {
					"type": "string",
					"description": "Pointer to the GLB/glTF/VRM file. SHOULD be ipfs:// for immutability."
				},
				"format": {
					"type": "string",
					"enum": ["gltf-binary", "gltf", "vrm"]
				},
				"sha256": {
					"type": "string",
					"pattern": "^[a-f0-9]{64}$",
					"description": "Lowercase hex SHA-256 of the model bytes. Lets consumers verify the file independently of the URI."
				},
				"sizeBytes": { "type": "integer", "minimum": 0 },
				"polygonCount": { "type": "integer", "minimum": 0 },
				"boundingBox": {
					"type": "object",
					"description": "Axis-aligned bounding box in meters, model space.",
					"required": ["min", "max"],
					"properties": {
						"min": { "type": "array", "items": { "type": "number" }, "minItems": 3, "maxItems": 3 },
						"max": { "type": "array", "items": { "type": "number" }, "minItems": 3, "maxItems": 3 }
					}
				},
				"license": {
					"type": "string",
					"description": "SPDX license identifier or URL to a license document."
				}
			}
		},

		"manifest": {
			"type": "object",
			"description": "Optional pointer to the full off-chain agent manifest (see specs/AGENT_MANIFEST.md). Use when the agent has a brain/voice/skills bundle.",
			"required": ["uri"],
			"properties": {
				"uri": { "type": "string" },
				"spec": { "type": "string", "description": "e.g. \"agent-manifest/0.2\"" }
			}
		},

		"validation": {
			"type": "object",
			"description": "Optional pointer to a signed validation report (see public/validation/REPORT_FORMAT.md).",
			"required": ["reportUri"],
			"properties": {
				"reportUri": { "type": "string" },
				"reportType": { "type": "string", "description": "e.g. \"agent-validation-report/0.1\"" },
				"validator": { "type": "string", "pattern": "^0x[a-fA-F0-9]{40}$" }
			}
		},

		"previousVersion": {
			"type": "string",
			"description": "URI of the prior agent card (provenance chain). SHOULD be ipfs:// content hash."
		}
	}
}
