{
	"type": [
		"https://eips.ethereum.org/EIPS/eip-8004#registration-v1",
		"https://three.ws/specs/3d-agent-card-v1"
	],
	"name": "three.ws",
	"description": "AI-powered 3D model viewer and validation agent. Drag and drop glTF, GLB, and 3D files to preview instantly in your browser. Supports real-time rendering, model validation, environment maps, and animation playback via Three.js and WebGL.",
	"image": "https://three.ws/og-image.png",
	"active": true,
	"model": {
		"uri": "https://three.ws/avatars/cz.glb",
		"format": "gltf-binary",
		"sha256": "e81d3b9d6bd2e5e2e97effd270b12bc608063e0340ab9df053a23a84e7c6f36b",
		"sizeBytes": 2195336,
		"license": "CC-BY-4.0"
	},
	"services": [
		{
			"name": "web",
			"endpoint": "https://three.ws/"
		},
		{
			"name": "A2A",
			"endpoint": "https://three.ws/.well-known/agent-card.json",
			"version": "0.3.0"
		},
		{
			"name": "MCP",
			"endpoint": "https://three.ws/.well-known/openapi.yaml",
			"version": "2025-06-18"
		}
	],
	"x402Support": false,
	"registrations": [],
	"supportedTrust": ["reputation"]
}
